path	family	source	license	page_count	features	notes
fixtures/generated/spot-letterhead-separation.pdf	separation-business	scripts/generate_fixtures.py	MIT OR Apache-2.0	1	color,spot,separation,tint-transform,letterhead,business-document,expected:native	Letterhead-style Separation brand-color sample for thumbnail visual review.
fixtures/generated/spot-invoice-devicen-stamp.pdf	devicen-business	scripts/generate_fixtures.py	MIT OR Apache-2.0	1	color,spot,devicen,tint-transform,business-document,stamp,expected:native	Invoice-style DeviceN approval stamp sample for thumbnail visual review.
fixtures/generated/spot-cmyk-tint-swatch.pdf	separation-cmyk	scripts/generate_fixtures.py	MIT OR Apache-2.0	1	color,spot,separation,tint-transform,cmyk,tint-swatch,expected:native	CMYK alternate spot-color tint swatch sample for bounded tint-transform review.
fixtures/generated/separation-spot-color.pdf	separation-baseline	scripts/generate_fixtures.py	MIT OR Apache-2.0	1	color,spot,separation,tint-transform,expected:native	Existing Separation spot-color baseline with DeviceCMYK alternate tint approximation.
fixtures/generated/devicen-spot-color.pdf	devicen-baseline	scripts/generate_fixtures.py	MIT OR Apache-2.0	1	color,spot,devicen,tint-transform,expected:native	Existing DeviceN spot-color baseline with Type 2 tint approximation.
fixtures/generated/overprint-spot-approximation.pdf	overprint-baseline	scripts/generate_fixtures.py	MIT OR Apache-2.0	1	overprint,spot-color,separation,expected:native	Existing overprint spot-color approximation baseline.
fixtures/generated/prepress-spot-overprint-boundary.pdf	prepress-boundary	scripts/generate_fixtures.py	MIT OR Apache-2.0	1	prepress,spot-color,overprint,separation,approximation,expected:native	Existing prepress boundary sample for spot-color and overprint thumbnail approximation.
